{
  "resourceType" : "ImmunizationEvaluation",
  "id" : "example",
  "text" : {
    "status" : "generated",
    "div" : "<div xmlns=\"http://www.w3.org/1999/xhtml\"><p><b>Generated Narrative: ImmunizationEvaluation</b><a name=\"example\"> </a></p><div style=\"display: inline-block; background-color: #d9e0e7; padding: 6px; margin: 4px; border: 1px solid #8da1b4; border-radius: 5px; line-height: 60%\"><p style=\"margin-bottom: 0px\">Resource ImmunizationEvaluation &quot;example&quot; </p></div><p><b>identifier</b>: id:\u00a0urn:oid:1.3.6.1.4.1.21367.2005.3.7.1234</p><p><b>status</b>: completed</p><p><b>patient</b>: <a href=\"patient-example.html\">Patient/example</a> &quot;Peter CHALMERS&quot;</p><p><b>date</b>: 2013-01-10</p><p><b>authority</b>: <a href=\"organization-example.html\">Organization/hl7</a> &quot;Health Level Seven International&quot;</p><p><b>targetDisease</b>: Gestational rubella syndrome <span style=\"background: LightGoldenRodYellow; margin: 4px; border: 1px solid khaki\"> (<a href=\"https://browser.ihtsdotools.org/\">SNOMED CT</a>#1857005)</span></p><p><b>immunizationEvent</b>: <a href=\"immunization-example.html\">Immunization/example</a></p><p><b>doseStatus</b>: Valid <span style=\"background: LightGoldenRodYellow; margin: 4px; border: 1px solid khaki\"> (<a href=\"http://terminology.hl7.org/5.1.0/CodeSystem-immunization-evaluation-dose-status.html\">Immunization Evaluation Dose Status codes</a>#valid)</span></p><p><b>series</b>: Vaccination Series 1</p><p><b>doseNumber</b>: 1</p><p><b>seriesDoses</b>: 3</p></div>"
  },
  "identifier" : [{
    "system" : "urn:ietf:rfc:3986",
    "value" : "urn:oid:1.3.6.1.4.1.21367.2005.3.7.1234"
  }],
  "status" : "completed",
  "patient" : {
    "reference" : "Patient/example"
  },
  "date" : "2013-01-10",
  "authority" : {
    "reference" : "Organization/hl7"
  },
  "targetDisease" : {
    "coding" : [{
      "system" : "http://snomed.info/sct",
      "code" : "1857005"
    }]
  },
  "immunizationEvent" : {
    "reference" : "Immunization/example"
  },
  "doseStatus" : {
    "coding" : [{
      "system" : "http://terminology.hl7.org/CodeSystem/immunization-evaluation-dose-status",
      "code" : "valid",
      "display" : "Valid"
    }]
  },
  "series" : "Vaccination Series 1",
  "doseNumber" : "1",
  "seriesDoses" : "3"
}
